{
  "$schema": "https://json-schema.org/draft/2020-12/schema",
  "$id": "https://github.com/logic-builder/logic-builder/logic.schema.json",
  "title": "logic-builder file",
  "description": "A logic diagram (function block diagram) of one subject: a feature, flow, tool or pipeline.",
  "type": "object",
  "required": [
    "version",
    "subject",
    "nodes",
    "wires"
  ],
  "additionalProperties": false,
  "properties": {
    "$schema": {
      "type": "string"
    },
    "version": {
      "const": "0.1"
    },
    "subject": {
      "$ref": "#/$defs/subject"
    },
    "types": {
      "type": "object",
      "additionalProperties": {
        "$ref": "#/$defs/typeExpr"
      }
    },
    "typeInfo": {
      "type": "object",
      "description": "What a named type means and where it is defined. Keys must be names in \"types\".",
      "additionalProperties": {
        "$ref": "#/$defs/typeInfo"
      }
    },
    "blockTypes": {
      "type": "object",
      "additionalProperties": {
        "$ref": "#/$defs/blockType"
      }
    },
    "nodes": {
      "type": "array",
      "items": {
        "$ref": "#/$defs/node"
      }
    },
    "wires": {
      "type": "array",
      "items": {
        "$ref": "#/$defs/wire"
      }
    },
    "risks": {
      "type": "array",
      "items": {
        "$ref": "#/$defs/risk"
      }
    }
  },
  "$defs": {
    "id": {
      "type": "string",
      "minLength": 1,
      "pattern": "^[^./\\s]+$"
    },
    "portRef": {
      "type": "string",
      "minLength": 1
    },
    "typeExpr": {
      "anyOf": [
        {
          "type": "string",
          "minLength": 1
        },
        {
          "type": "object",
          "required": [
            "oneOf"
          ],
          "additionalProperties": false,
          "properties": {
            "oneOf": {
              "type": "array",
              "minItems": 1,
              "items": {
                "$ref": "#/$defs/typeExpr"
              }
            }
          }
        },
        {
          "type": "object",
          "additionalProperties": {
            "$ref": "#/$defs/typeExpr"
          }
        }
      ]
    },
    "ports": {
      "type": "object",
      "propertyNames": {
        "pattern": "^[^.\\s]+$"
      },
      "additionalProperties": {
        "$ref": "#/$defs/typeExpr"
      }
    },
    "change": {
      "enum": [
        "existing",
        "new",
        "modified",
        "removed"
      ]
    },
    "codeRef": {
      "type": "object",
      "required": [
        "file"
      ],
      "additionalProperties": false,
      "properties": {
        "file": {
          "type": "string",
          "minLength": 1
        },
        "symbol": {
          "type": "string",
          "minLength": 1
        }
      }
    },
    "typeInfo": {
      "type": "object",
      "additionalProperties": false,
      "properties": {
        "desc": {
          "type": "string"
        },
        "code": {
          "$ref": "#/$defs/codeRef"
        },
        "change": {
          "const": "modified"
        },
        "before": {
          "$ref": "#/$defs/typeExpr"
        }
      }
    },
    "subject": {
      "type": "object",
      "required": [
        "id",
        "title",
        "intent",
        "mode"
      ],
      "additionalProperties": false,
      "properties": {
        "id": {
          "$ref": "#/$defs/id"
        },
        "title": {
          "type": "string",
          "minLength": 1
        },
        "intent": {
          "type": "string",
          "minLength": 1
        },
        "scope": {
          "type": "string"
        },
        "mode": {
          "enum": [
            "understand",
            "design"
          ]
        },
        "focus": {
          "$ref": "#/$defs/id"
        }
      }
    },
    "node": {
      "type": "object",
      "required": [
        "id",
        "kind",
        "label"
      ],
      "additionalProperties": false,
      "properties": {
        "id": {
          "$ref": "#/$defs/id"
        },
        "kind": {
          "enum": [
            "trigger",
            "function",
            "state",
            "decision",
            "external",
            "result",
            "group",
            "instance",
            "pin"
          ]
        },
        "label": {
          "type": "string",
          "minLength": 1
        },
        "desc": {
          "type": "string",
          "description": "What the block does, in one or two sentences."
        },
        "logic": {
          "$ref": "#/$defs/logicGuide"
        },
        "parent": {
          "$ref": "#/$defs/id"
        },
        "inputs": {
          "$ref": "#/$defs/ports"
        },
        "outputs": {
          "$ref": "#/$defs/ports"
        },
        "code": {
          "$ref": "#/$defs/codeRef"
        },
        "ref": {
          "type": "string"
        },
        "change": {
          "$ref": "#/$defs/change"
        },
        "changeNote": {
          "type": "string"
        },
        "before": {
          "type": "object",
          "additionalProperties": false,
          "properties": {
            "label": {
              "type": "string"
            },
            "desc": {
              "type": "string"
            },
            "inputs": {
              "$ref": "#/$defs/ports"
            },
            "outputs": {
              "$ref": "#/$defs/ports"
            },
            "code": {
              "$ref": "#/$defs/codeRef"
            },
            "parent": {
              "$ref": "#/$defs/id"
            },
            "valueType": {
              "$ref": "#/$defs/typeExpr"
            },
            "source": {
              "enum": [
                "user",
                "schedule",
                "http",
                "agent",
                "system"
              ]
            },
            "context": {
              "type": "object"
            }
          }
        },
        "source": {
          "enum": [
            "user",
            "schedule",
            "http",
            "agent",
            "system"
          ]
        },
        "context": {
          "type": "object"
        },
        "valueType": {
          "$ref": "#/$defs/typeExpr"
        },
        "store": {
          "type": "string",
          "description": "state only: where the data lives and how long it lasts, e.g. \"Zustand store · lost on reload\"."
        },
        "of": {
          "type": "string",
          "minLength": 1
        },
        "explored": {
          "type": "boolean"
        },
        "see": {
          "type": "string",
          "pattern": "^[^/\\\\#]+\\.logic\\.json(#[^./#]+)?$",
          "description": "Another diagram in the same folder that explains this block: file.logic.json or file.logic.json#node-id."
        },
        "note": {
          "type": "string",
          "description": "A request left for the agent in the viewer. Not a change: the agent deletes it once it is done."
        }
      },
      "allOf": [
        {
          "if": {
            "properties": {
              "kind": {
                "const": "instance"
              }
            }
          },
          "then": {
            "required": [
              "of"
            ]
          }
        },
        {
          "if": {
            "properties": {
              "kind": {
                "const": "trigger"
              }
            }
          },
          "then": {
            "required": [
              "source"
            ]
          }
        }
      ]
    },
    "wire": {
      "type": "object",
      "required": [
        "id",
        "from",
        "to"
      ],
      "additionalProperties": false,
      "properties": {
        "id": {
          "$ref": "#/$defs/id"
        },
        "from": {
          "$ref": "#/$defs/portRef"
        },
        "to": {
          "$ref": "#/$defs/portRef"
        },
        "change": {
          "$ref": "#/$defs/change"
        },
        "op": {
          "enum": [
            "read",
            "write"
          ]
        },
        "draw": {
          "enum": [
            "line",
            "label"
          ],
          "description": "How the viewer draws the wire: a line, or labeled connectors. Omitted: automatic."
        },
        "before": {
          "type": "object",
          "additionalProperties": false,
          "properties": {
            "from": {
              "$ref": "#/$defs/portRef"
            },
            "to": {
              "$ref": "#/$defs/portRef"
            },
            "op": {
              "enum": [
                "read",
                "write"
              ]
            }
          }
        },
        "note": {
          "type": "string",
          "description": "A request left for the agent in the viewer. Not a change: the agent deletes it once it is done."
        }
      }
    },
    "body": {
      "type": "object",
      "required": [
        "nodes",
        "wires"
      ],
      "additionalProperties": false,
      "properties": {
        "nodes": {
          "type": "array",
          "items": {
            "$ref": "#/$defs/node"
          }
        },
        "wires": {
          "type": "array",
          "items": {
            "$ref": "#/$defs/wire"
          }
        }
      }
    },
    "blockType": {
      "type": "object",
      "required": [
        "label",
        "inputs",
        "outputs"
      ],
      "additionalProperties": false,
      "properties": {
        "label": {
          "type": "string",
          "minLength": 1
        },
        "desc": {
          "type": "string"
        },
        "logic": {
          "$ref": "#/$defs/logicGuide"
        },
        "inputs": {
          "$ref": "#/$defs/ports"
        },
        "outputs": {
          "$ref": "#/$defs/ports"
        },
        "code": {
          "$ref": "#/$defs/codeRef"
        },
        "change": {
          "$ref": "#/$defs/change"
        },
        "changeNote": {
          "type": "string"
        },
        "before": {
          "type": "object",
          "additionalProperties": false,
          "properties": {
            "label": {
              "type": "string"
            },
            "desc": {
              "type": "string"
            },
            "inputs": {
              "$ref": "#/$defs/ports"
            },
            "outputs": {
              "$ref": "#/$defs/ports"
            },
            "code": {
              "$ref": "#/$defs/codeRef"
            }
          }
        },
        "body": {
          "$ref": "#/$defs/body"
        }
      }
    },
    "risk": {
      "type": "object",
      "required": [
        "id",
        "severity",
        "status",
        "title",
        "refs"
      ],
      "additionalProperties": false,
      "properties": {
        "id": {
          "$ref": "#/$defs/id"
        },
        "severity": {
          "enum": [
            "high",
            "medium",
            "low"
          ]
        },
        "status": {
          "enum": [
            "open",
            "resolved"
          ]
        },
        "title": {
          "type": "string",
          "minLength": 1
        },
        "detail": {
          "type": "string"
        },
        "resolution": {
          "type": "string"
        },
        "refs": {
          "type": "array",
          "items": {
            "type": "string",
            "minLength": 1
          }
        }
      }
    },
    "logicGuide": {
      "description": "How the block works: a paragraph or ordered steps.",
      "anyOf": [
        {
          "type": "string",
          "minLength": 1
        },
        {
          "type": "array",
          "minItems": 1,
          "items": {
            "type": "string",
            "minLength": 1
          }
        }
      ]
    }
  }
}
